{"finding_id": "finding_arch_bypass", "pr_id": "pr_seed_001", "reviewer_id": "rev_001", "status": "addressed", "summary": "Patch writes directly to data/store.json; architecture requires repository_layer under src/repo/", "required_action": "Fix implementation to use src/repo/; do not revise architecture.json", "evidence_path": "src/handlers/inventory.js"}